{"automation_status":"passed_auto_checks","card_status":"calibrated","created_at":"2026-01-01T00:00:01Z","domain_profile_id":"synthetic-p2-catalog","fixture_origin":"synthetic_from_scratch","paper_id":"paper_08c0dd81-5b44-4d2f-9d32-662fb3e15ae5","review_status":"ai_checked","schema_version":"1.0","sections":[{"section_id":"research_background_significance","units":[]},{"section_id":"research_problem","units":[{"boundary_refs":[],"confidence":"medium","evidence_ids":["evidence_20cbe39d-3cba-4ba8-980f-bc6399026bf6"],"grounding_status":"grounded","section_id":"research_problem","source_page":{"figure_or_table":null,"pdf_page":1,"printed_page":null,"section":"Synthetic results"},"statement":"Synthetic Card Unit 1 for item 00000002.","statement_type":"reported_result","unit_id":"unit_a99702c0-9324-443e-ad51-07886ed0ceec"}]},{"section_id":"method_principle_advantages","units":[{"boundary_refs":[],"confidence":"medium","evidence_ids":["evidence_20cbe39d-3cba-4ba8-980f-bc6399026bf6"],"grounding_status":"grounded","section_id":"method_principle_advantages","source_page":{"figure_or_table":null,"pdf_page":1,"printed_page":null,"section":"Synthetic results"},"statement":"Synthetic Card Unit 2 for item 00000002.","statement_type":"method_description","unit_id":"unit_79bbe264-da51-4e6b-b4ea-0743d263adb5"}]},{"section_id":"conclusions_applications","units":[]},{"section_id":"innovation","units":[]},{"section_id":"limitations","units":[{"boundary_refs":[],"confidence":"medium","evidence_ids":["evidence_20cbe39d-3cba-4ba8-980f-bc6399026bf6"],"grounding_status":"grounded","section_id":"limitations","source_page":{"figure_or_table":null,"pdf_page":1,"printed_page":null,"section":"Synthetic results"},"statement":"Synthetic Card Unit 3 for item 00000002.","statement_type":"limitation","unit_id":"unit_883e23cb-da09-44c9-bb4e-d60beb22b5ac"}]},{"section_id":"future_outlook","units":[]}],"updated_at":"2026-01-01T00:00:01Z"}
