{"automation_status":"passed_auto_checks","card_status":"calibrated","created_at":"2026-01-01T00:00:00Z","domain_profile_id":"synthetic-p2-catalog","fixture_origin":"synthetic_from_scratch","paper_id":"paper_f8daed20-fcf0-4ed8-9795-694bd631def9","review_status":"ai_checked","schema_version":"1.0","sections":[{"section_id":"research_background_significance","units":[]},{"section_id":"research_problem","units":[{"boundary_refs":[],"confidence":"medium","evidence_ids":["evidence_f3f7e7b2-edfb-4aa4-a72f-0a82db692e6f"],"grounding_status":"grounded","section_id":"research_problem","source_page":{"figure_or_table":null,"pdf_page":1,"printed_page":null,"section":"Synthetic results"},"statement":"Synthetic Card Unit 1 for item 00000001.","statement_type":"reported_result","unit_id":"unit_34c69ef0-da0d-4754-a79f-7166f142b3c0"}]},{"section_id":"method_principle_advantages","units":[{"boundary_refs":[],"confidence":"medium","evidence_ids":["evidence_f3f7e7b2-edfb-4aa4-a72f-0a82db692e6f"],"grounding_status":"grounded","section_id":"method_principle_advantages","source_page":{"figure_or_table":null,"pdf_page":1,"printed_page":null,"section":"Synthetic results"},"statement":"Synthetic Card Unit 2 for item 00000001.","statement_type":"method_description","unit_id":"unit_2b8e2dae-fb46-48ca-8a22-44d60e291b26"}]},{"section_id":"conclusions_applications","units":[]},{"section_id":"innovation","units":[]},{"section_id":"limitations","units":[{"boundary_refs":[],"confidence":"medium","evidence_ids":["evidence_f3f7e7b2-edfb-4aa4-a72f-0a82db692e6f"],"grounding_status":"grounded","section_id":"limitations","source_page":{"figure_or_table":null,"pdf_page":1,"printed_page":null,"section":"Synthetic results"},"statement":"Synthetic Card Unit 3 for item 00000001.","statement_type":"limitation","unit_id":"unit_2d68f4d1-e1ba-4a7b-88f9-909dbbbf2f81"}]},{"section_id":"future_outlook","units":[]}],"updated_at":"2026-01-01T00:00:00Z"}
