{"automation_status":"passed_auto_checks","card_status":"calibrated","created_at":"2026-01-01T00:00:02Z","domain_profile_id":"synthetic-p2-catalog","fixture_origin":"synthetic_from_scratch","paper_id":"paper_acd26f79-337f-42b8-a687-84edb727a949","review_status":"ai_checked","schema_version":"1.0","sections":[{"section_id":"research_background_significance","units":[]},{"section_id":"research_problem","units":[{"boundary_refs":[],"confidence":"medium","evidence_ids":["evidence_fb388a96-5a75-4d31-a95a-2aa054fcda50"],"grounding_status":"grounded","section_id":"research_problem","source_page":{"figure_or_table":null,"pdf_page":1,"printed_page":null,"section":"Synthetic results"},"statement":"Synthetic Card Unit 1 for item 00000003.","statement_type":"reported_result","unit_id":"unit_fc6cc88d-e6b3-4cd2-aa4e-6c86311080dc"}]},{"section_id":"method_principle_advantages","units":[{"boundary_refs":[],"confidence":"medium","evidence_ids":["evidence_fb388a96-5a75-4d31-a95a-2aa054fcda50"],"grounding_status":"grounded","section_id":"method_principle_advantages","source_page":{"figure_or_table":null,"pdf_page":1,"printed_page":null,"section":"Synthetic results"},"statement":"Synthetic Card Unit 2 for item 00000003.","statement_type":"method_description","unit_id":"unit_6ca3641e-4a60-45be-aa08-620237f2382d"}]},{"section_id":"conclusions_applications","units":[]},{"section_id":"innovation","units":[]},{"section_id":"limitations","units":[{"boundary_refs":[],"confidence":"medium","evidence_ids":["evidence_fb388a96-5a75-4d31-a95a-2aa054fcda50"],"grounding_status":"grounded","section_id":"limitations","source_page":{"figure_or_table":null,"pdf_page":1,"printed_page":null,"section":"Synthetic results"},"statement":"Synthetic Card Unit 3 for item 00000003.","statement_type":"limitation","unit_id":"unit_190e2a71-ba9c-4d2c-a105-2afa0b798f65"}]},{"section_id":"future_outlook","units":[]}],"updated_at":"2026-01-01T00:00:02Z"}
